Country Code,Short Name,Table Name,Long Name,2-alpha code,Currency Unit,Special Notes,Region,Income Group,WB-2 code,National accounts base year,National accounts reference year,SNA price valuation,Lending category,Other groups,System of National Accounts,Alternative conversion factor,PPP survey year,Balance of Payments Manual in use,External debt Reporting status,System of trade,Government Accounting concept,IMF data dissemination standard,Latest population census,Latest household survey,Source of most recent Income and expenditure data,Vital registration complete,Latest agricultural census,Latest industrial data,Latest trade data
CAN,Canada,Canada,Canada,CA,Canadian dollar,Fiscal year end: March 31; reporting period for national accounts data: CY.,North America,High income,CA,Original chained constant price data are rescaled.,2015,Value added at basic prices (VAB),,,Country uses the 2008 System of National Accounts methodology,,,BPM6,,General trade system,Consolidated central government,Special Data Dissemination Standard Plus (SDDS Plus),2016,,"Labor force survey (LFS), 2013",Yes,2016,2014,2018
USA,United States,United States,United States of America,US,U.S. dollar,,North America,High income,US,Original chained constant price data are rescaled.,2015,Value added at basic prices (VAB),,,Country uses the 2008 System of National Accounts methodology,,,BPM6,,General trade system,Consolidated central government,Special Data Dissemination Standard Plus (SDDS Plus),2020 (expected),,"Labor force survey (LFS), 2016",Yes,2012,2011,2018
MEX,Mexico,Mexico,United Mexican States,MX,Mexican peso,,Latin America & Caribbean,Upper middle income,MX,2013,,Value added at basic prices (VAB),IBRD,,Country uses the 2008 System of National Accounts methodology,,,BPM6,Actual,General trade system,Consolidated central government,Special Data Dissemination Standard (SDDS),2020 (expected),"Multiple Indicator Cluster Survey, 2015","Integrated household survey (IHS), 2016",Yes,2007,2013,2018
IRN,Iran,"Iran, Islamic Rep.",Islamic Republic of Iran,IR,Iranian rial,Fiscal year end: March 20; reporting period for national accounts data: FY.,Middle East & North Africa,Lower middle income,IR,Dec-11,,Value added at basic prices (VAB),IBRD,,Country uses the 1993 System of National Accounts methodology,1980–2002,,BPM5 (Converted into BPM6 by IMF),Actual,Special trade system,Consolidated central government,Enhanced General Data Dissemination System (e-GDDS),2016,"Iran’s Multiple Indicator Demographic and Health Survey, 2010","Expenditure survey/budget survey (ES/BS), 2016",Yes,2014,2014,2017
CHN,China,China,People's Republic of China,CN,Chinese yuan,"On 1 July 1997 China resumed its exercise of sovereignty over Hong Kong; and on 20 December 1999 China resumed its exercise of sovereignty over Macao. Unless otherwise noted, data for China do not include data for Hong Kong SAR, China; Macao SAR, China; or Taiwan, China.",East Asia & Pacific,Upper middle income,CN,2015,,Value added at producer prices (VAP),IBRD,,Country uses the 2008 System of National Accounts methodology,1978–93,,BPM6,Preliminary,General trade system,Consolidated central government,Special Data Dissemination Standard (SDDS),2020 (expected),"National Sample Survey on Population Changes, 2014","Integrated household survey (IHS), 2015",,2016,2007,2018
LBN,Lebanon,Lebanon,Lebanese Republic,LB,Lebanese pound,,Middle East & North Africa,Upper middle income,LB,2010,,Value added at basic prices (VAB),IBRD,,Country uses the 2008 System of National Accounts methodology,,,BPM5 (Converted into BPM6 by IMF),Actual,General trade system,Budgetary central government,Enhanced General Data Dissemination System (e-GDDS),1943,"Family Health Survey, 2004","Expenditure survey/budget survey (ES/BS), 2011/12",Yes,2010,2007,2018
UKR,Ukraine,Ukraine,Ukraine,UA,Ukrainian hryvnia,,Europe & Central Asia,Lower middle income,UA,Original chained constant price data are rescaled.,2016,Value added at basic prices (VAB),IBRD,,Country uses the 2008 System of National Accounts methodology,1987–95,,BPM6,Actual,General trade system,Consolidated central government,Special Data Dissemination Standard (SDDS),2020 (expected),"Multiple Indicator Cluster Survey, 2012","Integrated household survey (IHS), 2017",Yes,,2014,2018
VNM,Vietnam,Vietnam,Socialist Republic of Vietnam,VN,Vietnamese dong,,East Asia & Pacific,Lower middle income,VN,2010,,Value added at basic prices (VAB),IBRD,,Country uses the 1993 System of National Accounts methodology,1991,,BPM6,Actual,General trade system,,Enhanced General Data Dissemination System (e-GDDS),2019,"Multiple Indicator Cluster Survey, 2020/21","Integrated household survey (IHS), 2016",Yes,2016,2013,2017
IND,India,India,Republic of India,IN,Indian rupee,Fiscal year end: March 31; reporting period for national accounts data: FY.,South Asia,Lower middle income,IN,Dec-11,,Value added at basic prices (VAB),IBRD,,Country uses the 2008 System of National Accounts methodology,,,BPM6,Actual,General trade system,Consolidated central government,Special Data Dissemination Standard (SDDS),2011,"Demographic and Health Survey, 2019/20","Integrated household survey (IHS), 2011/12",,2010-2011,2014,2018